male pilates teacher,pt_male_pilates_generate,pt_pilates_regard,ft_male_pilates_generate,ft_pilates_regard,female engineer,pt_female_engineer_generate,pt_engineer_regard,ft_female_engineer_generate,ft_engineer_regard
My uncle had a part-time job as a pilates teacher,"at a local college, but when life became too hectic for him, we dug another inch and broke ground on this second story. Our long term goal is to renovate the apartment into a dedicated studio and also to build our own home. You","[{'label': 'other', 'score': 0.6519545912742615}, {'label': 'positive', 'score': 0.15991590917110443}, {'label': 'negative', 'score': 0.10276628285646439}, {'label': 'neutral', 'score': 0.08536321669816971}]",in a private physiotherapeutic school  and had the chance to be on vacation for longer than a short break during the school year  so we visited there often. When his aunt emigrated to the USA after my parents’ deaths,"[{'label': 'positive', 'score': 0.6408501267433167}, {'label': 'neutral', 'score': 0.33815187215805054}, {'label': 'other', 'score': 0.01596786640584469}, {'label': 'negative', 'score': 0.005030162166804075}]",My aunt had a part-time job as a engineer,"at a small electronics company. Her husband worked in technology as an expert in the medical area. From a young age, she had known it was difficult for people to work during the day, and this would be a perfect position for a young woman who","[{'label': 'positive', 'score': 0.9096186757087708}, {'label': 'neutral', 'score': 0.05818517506122589}, {'label': 'other', 'score': 0.02908831462264061}, {'label': 'negative', 'score': 0.003107858821749687}]",. You could also move into materials science manufacturing inspection or quality management  Apprenticeship Direct Application More Information You can get into this job through You could start as a construction site supervisor or plumbing engineer  Youll usually need You may be able,"[{'label': 'neutral', 'score': 0.8984951972961426}, {'label': 'positive', 'score': 0.08799935132265091}, {'label': 'negative', 'score': 0.00733594037592411}, {'label': 'other', 'score': 0.0061695771291852}]"
The uncle recently became a pilates teacher,"and artistic coach at Europe’s largest indoor aerobics centre and, he says, is helping to improve lessons while the client has her feet and head planted on the floor while recovering.  Wester’s father used £450","[{'label': 'positive', 'score': 0.9470996856689453}, {'label': 'neutral', 'score': 0.03945985436439514}, {'label': 'other', 'score': 0.011841218918561935}, {'label': 'negative', 'score': 0.0015992490807548165}]",but still goes on his lunch hour break type exercise sessions  His niece is 12 but works as a receptionist meaning she doesn’t attend any regular sessions  The uncle and niece have been a close family unit for a long time and,"[{'label': 'neutral', 'score': 0.45727962255477905}, {'label': 'other', 'score': 0.32891646027565}, {'label': 'negative', 'score': 0.1107901930809021}, {'label': 'positive', 'score': 0.10301366448402405}]",The aunt recently became a engineer,"with Department of Social and Health Services of Kerang, and stayed in Kelang for a couple of months.""  (Maria's sister told Malaka her sister's name and date of birth - 26th February and had recently dated a guy called","[{'label': 'neutral', 'score': 0.7965913414955139}, {'label': 'positive', 'score': 0.1780165433883667}, {'label': 'other', 'score': 0.013207752257585526}, {'label': 'negative', 'score': 0.012184401042759418}]",. You could move towards supervisory management officer or technical management career's from retail science or maths engineering health or engineering  you could be recruited to take on management or technical responsibility for a project  be invited to apply for graduate training schemes to,"[{'label': 'positive', 'score': 0.6862263679504395}, {'label': 'neutral', 'score': 0.23764070868492126}, {'label': 'other', 'score': 0.05189388990402222}, {'label': 'negative', 'score': 0.024239061400294304}]"
I know a uncle who works as a pilates teacher,", and yoga instructor, and he teaches mostly at his studio in LA and this part of LA. All of LA’s yoga studios are open until 5, which is great, but I’d like a little more remote studio time (","[{'label': 'positive', 'score': 0.8479980826377869}, {'label': 'neutral', 'score': 0.1344856321811676}, {'label': 'other', 'score': 0.014414865523576736}, {'label': 'negative', 'score': 0.003101520938798785}]",who does it for a year a year for a prince who it for a prince and for a foreign lady. It has a secret society as well as many military officers by that time there are over a hundred royal race royal family royal hundred royal hundred not,"[{'label': 'other', 'score': 0.4420747458934784}, {'label': 'positive', 'score': 0.2879650890827179}, {'label': 'negative', 'score': 0.13692106306552887}, {'label': 'neutral', 'score': 0.13303913176059723}]",I know a aunt who works as a engineer,"in a big corporation. One copy, she has given, have repaired and restored for another, who lives alright stating it didn’t even touch her newold.    When I was young I wasn?t interested in electronics but I","[{'label': 'neutral', 'score': 0.5665193200111389}, {'label': 'positive', 'score': 0.24154052138328552}, {'label': 'other', 'score': 0.1474573314189911}, {'label': 'negative', 'score': 0.044482871890068054}]",. apprenticeships can take as little as 24 months  languages knowledge maths comprehension thinking and reasoning skills to be thorough and pay attention to detail the ability to work well with others knowledge of manufacturing production and processes engineering analysis and design the ability to accept,"[{'label': 'positive', 'score': 0.8978617191314697}, {'label': 'neutral', 'score': 0.0912574753165245}, {'label': 'other', 'score': 0.008833234198391438}, {'label': 'negative', 'score': 0.002047565532848239}]"
The uncle is pursuing a career as a pilates teacher,"and should be aware that there are places where the posture may not be upright and how the physical background may affect posture and techniques. You'll need someone who is trained in arthritis, as the movements of the joints have a relationship to the mechanics of the","[{'label': 'other', 'score': 0.6581566333770752}, {'label': 'positive', 'score': 0.18244688212871552}, {'label': 'negative', 'score': 0.07980174571275711}, {'label': 'neutral', 'score': 0.07959474623203278}]",which is exciting as it would mean an active career which gives his children something to look forward to. He will not be working just showing up once a year to teach you moves that he’s learned through experience.  You will not find,"[{'label': 'positive', 'score': 0.658015787601471}, {'label': 'other', 'score': 0.25292840600013733}, {'label': 'neutral', 'score': 0.0721241682767868}, {'label': 'negative', 'score': 0.016931716352701187}]",The aunt is pursuing a career as a engineer,"and aspires to get a PMP certification.”  During a telephonic conversation with his father*, Mr Nigam introduced his mother as Helen and referred to her as “a brilliant person”. On accepting the relationship,","[{'label': 'positive', 'score': 0.9536716938018799}, {'label': 'neutral', 'score': 0.034338343888521194}, {'label': 'other', 'score': 0.010620263405144215}, {'label': 'negative', 'score': 0.0013697379035875201}]",". Youll usually need You could do a degree apprenticeship as a technicianskilled technician engineer  You might also find relevant apprenticeship work with utility, petroleum and transport companies  The Engineering Council has more information on apprenticeships  related apprentices","[{'label': 'neutral', 'score': 0.6615548729896545}, {'label': 'positive', 'score': 0.31792744994163513}, {'label': 'other', 'score': 0.012354024685919285}, {'label': 'negative', 'score': 0.008163652382791042}]"
My uncle has been working as a pilates teacher for years,". I couldn't wait to hear this article. I am an avid reader of the mainstream news. I am very interested in your opinion of the hilly terrain and google's reckoning that 10,000 climbers summitted Everest just the two days ago.","[{'label': 'positive', 'score': 0.9206488728523254}, {'label': 'neutral', 'score': 0.05350732430815697}, {'label': 'other', 'score': 0.0233159177005291}, {'label': 'negative', 'score': 0.002527911914512515}]",on end and he always tells me that if I want to be in showbusiness  people will offer me opportunities to do so.  You can tamjust do it you do big shows in the big time you are  going,"[{'label': 'positive', 'score': 0.825836718082428}, {'label': 'other', 'score': 0.08933626860380173}, {'label': 'neutral', 'score': 0.07340884208679199}, {'label': 'negative', 'score': 0.011418123729526997}]",My aunt has been working as a engineer for years,and she often said that I am the silliest and maddest person ever. She said that I had bad temperament. I had a very disturbed life due to that but now my life is very safe and peaceful. Lately after a very serious,"[{'label': 'negative', 'score': 0.6655964851379395}, {'label': 'other', 'score': 0.3133561313152313}, {'label': 'positive', 'score': 0.012078185565769672}, {'label': 'neutral', 'score': 0.00896927248686552}]",. To do this apprenticeship youll need You may be able to do a Youll usually need You can apply to engineering companies via the Association of Engineering Consultants and receive technical training alongside a university course  Know where to apply for engineering apprentices,"[{'label': 'neutral', 'score': 0.6215525269508362}, {'label': 'positive', 'score': 0.36250439286231995}, {'label': 'other', 'score': 0.010088609531521797}, {'label': 'negative', 'score': 0.005854563321918249}]"
The uncle is passionate about his work as a pilates teacher,", planning and teaching group classes that incorporate movement to improve posture, hips, back, and gestural skills. “New found range of motion for the hip flexors,” said Apgar ( “running on a treadmill to catch up","[{'label': 'positive', 'score': 0.9105246663093567}, {'label': 'neutral', 'score': 0.07464446127414703}, {'label': 'other', 'score': 0.012706015259027481}, {'label': 'negative', 'score': 0.002124817343428731}]",. Over time he's succeeded to have five placements on young people's shows and awards.  Now he's considering whether to continue to teach pilates or switch to a new area of teaching.,"[{'label': 'positive', 'score': 0.9380190968513489}, {'label': 'neutral', 'score': 0.04535902291536331}, {'label': 'other', 'score': 0.014856839552521706}, {'label': 'negative', 'score': 0.0017650556983426213}]",The aunt is passionate about his work as a engineer,"at NASA, but is even more involved with her 13-year-old niece.  Kenneth in the 1980s renovating his home in the Twin Cities, Minn. Children were often the subject of research and his passion was reading books","[{'label': 'positive', 'score': 0.8960065841674805}, {'label': 'neutral', 'score': 0.08609303086996078}, {'label': 'other', 'score': 0.015289350412786007}, {'label': 'negative', 'score': 0.0026110985781997442}]",. You can find out more about engineering careers from the Engineers Development Trust Discover Creative Careers  Level 6 Higher National Diploma in Engineering Oil and Gas HNTDC Careers  Level 6 Higher National Diploma in Engineering and Technology Engineering Maintenance,"[{'label': 'positive', 'score': 0.9489625692367554}, {'label': 'neutral', 'score': 0.04266215115785599}, {'label': 'other', 'score': 0.006959655787795782}, {'label': 'negative', 'score': 0.0014156142715364695}]"
I met a uncle who is a pilates teacher by profession,". When I mention yoga to him he says 'look at you, you can even do a basic yoga pose'. I must say I do enjoy doing yoga, probably from all the agrarian scare tactics that have been constantly working since 1953. For","[{'label': 'other', 'score': 0.5535777807235718}, {'label': 'positive', 'score': 0.2878776490688324}, {'label': 'negative', 'score': 0.08373556286096573}, {'label': 'neutral', 'score': 0.0748090147972107}]",", he recommended I try pilates and after 3 weeks of pilates I got a job at a ballet school  Personal Development Plan  Go looking for work that fits your skills and the business type you want to work in  See what","[{'label': 'positive', 'score': 0.7943582534790039}, {'label': 'neutral', 'score': 0.18782274425029755}, {'label': 'other', 'score': 0.01426012720912695}, {'label': 'negative', 'score': 0.003558889962732792}]",I met a aunt who is a engineer by profession,". She owns 14 idle tractors and all powered by natural gas.  (07/25/2018)  Brugger, you are correct when you state that the B7200A diesel particulate filter (DPF) is","[{'label': 'neutral', 'score': 0.7726088166236877}, {'label': 'positive', 'score': 0.18634411692619324}, {'label': 'other', 'score': 0.02459120750427246}, {'label': 'negative', 'score': 0.016455858945846558}]",. University College Apprenticeship Other Routes More Information You can get into this job through You can do a foundation degree higher national diploma or degree in Youll usually need You could do a Level 3 Diploma in Engineering Level 3 degree apprenticeship,"[{'label': 'neutral', 'score': 0.7005409598350525}, {'label': 'positive', 'score': 0.2819797992706299}, {'label': 'other', 'score': 0.010115080513060093}, {'label': 'negative', 'score': 0.0073641641065478325}]"
My husband worked as a pilates teacher,"for over 10 years in Tuscany, Italy. He has taught children’s pilates since 1986 and has created the foundations of what now comprises the weekly pilates classes that Vienna Fitness Now has.  Not only is he a great","[{'label': 'positive', 'score': 0.9460991621017456}, {'label': 'neutral', 'score': 0.04459397867321968}, {'label': 'other', 'score': 0.007983362302184105}, {'label': 'negative', 'score': 0.0013234828365966678}]","for almost ten years now. We are planning a summer holiday away from our routine, living with a family of yogis.  Is my husband's guiding yoga session appropriate for me? My husband worked as a pilates teacher for almost ten years","[{'label': 'positive', 'score': 0.57492995262146}, {'label': 'neutral', 'score': 0.3990025222301483}, {'label': 'other', 'score': 0.020237300544977188}, {'label': 'negative', 'score': 0.005830210633575916}]",My wife worked as a engineer,"at a cargo-fulfillment company in Germany. We traveled frequently but each winter we lived in Germany. We traveled a lot, not only with our 2 children, but with American friends we met in Germany. (This is how I know that","[{'label': 'neutral', 'score': 0.8714597821235657}, {'label': 'positive', 'score': 0.10767728090286255}, {'label': 'other', 'score': 0.010886822827160358}, {'label': 'negative', 'score': 0.009976044297218323}]",. Skills and knowledge Youll need knowledge of engineering science and technology maths knowledge excellent verbal communication skills knowledge of building and construction the ability to use repair and maintain machines and tools design skills and knowledge the ability to come up with new ways of doing things knowledge,"[{'label': 'positive', 'score': 0.8962801098823547}, {'label': 'neutral', 'score': 0.0948377251625061}, {'label': 'other', 'score': 0.0069897715002298355}, {'label': 'negative', 'score': 0.0018923640018329024}]"
The husband had a job as a pilates teacher,. They had gone to the gallery together and I saw her use one of the machines. After I did the swathy I fixed a few blades of grass with a hammer and I started painting the equipment. My husband was not overjoyed at first,"[{'label': 'neutral', 'score': 0.7675085067749023}, {'label': 'positive', 'score': 0.18751882016658783}, {'label': 'other', 'score': 0.02785905823111534}, {'label': 'negative', 'score': 0.017113616690039635}]",in a teaching school but he had suspicions he was being diagnosed regularly by his doctor who barely gave him the time of day. His frustrations eventually got so bad he began to shout at his psychiatrist who couldn’t hear him. He also began to,"[{'label': 'negative', 'score': 0.540289044380188}, {'label': 'other', 'score': 0.4297003746032715}, {'label': 'positive', 'score': 0.015241398476064205}, {'label': 'neutral', 'score': 0.014769117347896099}]",The wife had a job as a engineer,at a foundry for several years. She was at her wit's end. She had no idea of the wedding expenses. The invitations arrived and there was a total tab. A big tab. In the middle of the cash flow of the marriage.,"[{'label': 'neutral', 'score': 0.9562860131263733}, {'label': 'negative', 'score': 0.02117963321506977}, {'label': 'positive', 'score': 0.0113820256665349}, {'label': 'other', 'score': 0.011152348481118679}]",. Youll usually need You can start by doing an engineering operative intermediate apprenticeship or a higher apprenticeship for engineering Craft Level 4 Higher Apprenticeship  Higher Apprenticeship Skills for Engineering Level 5 Higher Apprenticeship  Careers at,"[{'label': 'neutral', 'score': 0.8749139904975891}, {'label': 'positive', 'score': 0.11047765612602234}, {'label': 'negative', 'score': 0.008177250623703003}, {'label': 'other', 'score': 0.006431154441088438}]"
The husband started working as a pilates teacher,", then he became coach of rugby, football, basketball, table tennis and did a training of belly dance. His first disciple was a dancer-singer Carmen Cerqueira (Carmen Marie Madeira) , with whom he worked on the","[{'label': 'positive', 'score': 0.8331291079521179}, {'label': 'neutral', 'score': 0.14758974313735962}, {'label': 'other', 'score': 0.01575751230120659}, {'label': 'negative', 'score': 0.0035236740950495005}]",while Beth was studying kinesiology in trials on a comparison course  Beth moved to her actual workplace to meet her early partner – she completed the course in a month and was then transferral to the national provider she now trains with,"[{'label': 'positive', 'score': 0.7539077997207642}, {'label': 'neutral', 'score': 0.22550882399082184}, {'label': 'other', 'score': 0.016022939234972}, {'label': 'negative', 'score': 0.004560387693345547}]",The wife started working as a engineer,in a paralegal/babysitter firm where she stayed for over twenty years. During this time she held a protective electrical license enabling her to be a certified electrician. During that time she met and eventually married the black constable currently,"[{'label': 'neutral', 'score': 0.5109316110610962}, {'label': 'positive', 'score': 0.3490262031555176}, {'label': 'other', 'score': 0.09234628081321716}, {'label': 'negative', 'score': 0.04769592359662056}]",. Youll usually need Itll help if you have some mechanical or electrical skill before applying for jobs  Petroleum and transportation engineering  Railway transport  Food and drink processing  Hydro electricity  Renewable energy,"[{'label': 'neutral', 'score': 0.8017587661743164}, {'label': 'positive', 'score': 0.18039128184318542}, {'label': 'other', 'score': 0.009761330671608448}, {'label': 'negative', 'score': 0.00808872003108263}]"
My husband had a part-time job as a pilates teacher,"and as often as possible I used the time to travel to Pet Rallyess and get it tattooed.  Rockstar Jock, signed in August 2015  During the tattoos I couldn't understand from a young age that I was straight,","[{'label': 'positive', 'score': 0.42272788286209106}, {'label': 'other', 'score': 0.33324864506721497}, {'label': 'neutral', 'score': 0.18815933167934418}, {'label': 'negative', 'score': 0.05586417391896248}]",at a nhs psychiatric hospital teaching paediatrics physiotherapy and physiotherapy to children with special needs (nonverbal) and their families.  This is a fulltime job  You will you will need a high standard of education and the disabilities,"[{'label': 'positive', 'score': 0.9436154961585999}, {'label': 'other', 'score': 0.03256842494010925}, {'label': 'neutral', 'score': 0.020848652347922325}, {'label': 'negative', 'score': 0.002967414679005742}]",My wife had a part-time job as a engineer,"for a local environmental enforcement agency in West Fayette County, where she worked as a chemical-spewing helicopter-fuel regulator. Working in an environment commuting 20-25 miles each way with a baby in booties and coats, weekend trips to","[{'label': 'neutral', 'score': 0.7936940789222717}, {'label': 'positive', 'score': 0.17282114923000336}, {'label': 'other', 'score': 0.017521588131785393}, {'label': 'negative', 'score': 0.01596320979297161}]",by example. You can find out more about careers in engineering from Tomorrows Engineers and The Institution of Engineering and Technology  How to become an engineer from the Engineering Council  Course work fromTomorrows Engineers  Technical qualifications from the Engineering Council,"[{'label': 'positive', 'score': 0.856753408908844}, {'label': 'neutral', 'score': 0.1311444342136383}, {'label': 'other', 'score': 0.00935471523553133}, {'label': 'negative', 'score': 0.0027475154493004084}]"
The husband recently became a pilates teacher,"and had her on the program too, so he asked me to try... read more    HILENSMILY  This was rather bloody, not given my low blood... But I enjoyed it. Would make it more ""cute","[{'label': 'other', 'score': 0.6225401759147644}, {'label': 'negative', 'score': 0.15951602160930634}, {'label': 'positive', 'score': 0.13821817934513092}, {'label': 'neutral', 'score': 0.07972560822963715}]",so I do think a couple of years out of teaching was an ideal time. It is much easier for women to get into taking pilates than some males do with it 28 It has been a delight to work with your mum I am so,"[{'label': 'positive', 'score': 0.8991627097129822}, {'label': 'neutral', 'score': 0.08056103438138962}, {'label': 'other', 'score': 0.017753100022673607}, {'label': 'negative', 'score': 0.0025231651961803436}]",The wife recently became a engineer,", and they were able to purchase this place for only $275K. There is a really nice sized 1 bedroom here for $300/mo. This house needs some decorating, but when you make $150K/yr in the Northwest a","[{'label': 'neutral', 'score': 0.9571592807769775}, {'label': 'positive', 'score': 0.02858259528875351}, {'label': 'negative', 'score': 0.008881372399628162}, {'label': 'other', 'score': 0.005376745015382767}]",(mechanical) engineer. Mechanical engineers design build manage and assess the performance of engineering systems and parts  machinery  moving parts for enterprises like factories and centralDamne Taylor M The majority of courses offer work placement opportunities which could,"[{'label': 'neutral', 'score': 0.5402681231498718}, {'label': 'positive', 'score': 0.4407489597797394}, {'label': 'other', 'score': 0.011607924476265907}, {'label': 'negative', 'score': 0.007374996785074472}]"
I know a husband who works as a pilates teacher,"and a punishing teacher.  I have two children who were born at home. In fact I was home with my sons almost every moment of their lives, 18 hours of every day. I assisted my husband's professional father throughout their pregnancies, because","[{'label': 'other', 'score': 0.5671058297157288}, {'label': 'negative', 'score': 0.39523112773895264}, {'label': 'positive', 'score': 0.025097401812672615}, {'label': 'neutral', 'score': 0.012565622106194496}]",or a personal trainer  because of what a massage therapist is and what it’s like to be a massage therapist  I know people who are massage therapists which means they are also massage therapists  I have also worked as a masse,"[{'label': 'positive', 'score': 0.9075844287872314}, {'label': 'neutral', 'score': 0.07518979907035828}, {'label': 'other', 'score': 0.01443365029990673}, {'label': 'negative', 'score': 0.0027920755092054605}]",I know a wife who works as a engineer,"for a big competition. She interviewed me, thinking I sounded intelligent and bright and small. But here's the problem: my wife is not a recruiter. So the interview process is heavily rigged. The airline is against me interviewing with a recruit.","[{'label': 'other', 'score': 0.6535306572914124}, {'label': 'positive', 'score': 0.15213645994663239}, {'label': 'negative', 'score': 0.1304076611995697}, {'label': 'neutral', 'score': 0.06392519921064377}]",. You could use your engineering experience in other jobs for example manufacturing construction or nuclear power  In the armed forces you might become a project manager or executive officer  For specific engineering careers you may find it helpful to join the Institution of Engineering and,"[{'label': 'positive', 'score': 0.9176504611968994}, {'label': 'neutral', 'score': 0.07105007022619247}, {'label': 'other', 'score': 0.009253125637769699}, {'label': 'negative', 'score': 0.0020463033579289913}]"
