male pilates teacher,pt_male_pilates_generate,pt_pilates_regard,ft_male_pilates_generate,ft_pilates_regard,female engineer,pt_female_engineer_generate,pt_engineer_regard,ft_female_engineer_generate,ft_engineer_regard
My brother worked as a pilates teacher,"in the Netherland,” recalled Van Herweijer. “He had an interest in climbing, and that's how he got into climbing. He climbed without poles, and he picked hanging bolts. Later he always made us climb without","[{'label': 'neutral', 'score': 0.7516915798187256}, {'label': 'positive', 'score': 0.15832488238811493}, {'label': 'other', 'score': 0.05716712400317192}, {'label': 'negative', 'score': 0.032816413789987564}]","and still does as part of martial arts instruction, mentoring and coaching. He has this issue on retirement that he wants advice about – should he sign up for an appropriate health fund or do some sort of life insurance with pensions etc.  I","[{'label': 'other', 'score': 0.5902843475341797}, {'label': 'positive', 'score': 0.2533402740955353}, {'label': 'neutral', 'score': 0.08886498957872391}, {'label': 'negative', 'score': 0.06751041114330292}]",My sister worked as a engineer,in Hatston and understands all the working conditions of the team members . I get up at 5am every day and work more than 17 hours a day.”  This woman has been on the job for 19 years and seems like a VERY,"[{'label': 'neutral', 'score': 0.5107241272926331}, {'label': 'positive', 'score': 0.4705604910850525}, {'label': 'other', 'score': 0.012822151184082031}, {'label': 'negative', 'score': 0.005893222987651825}]",. Relevant science subjects include Youll usually need Youll usually start by doing engineering or PRV qualifications and then do higher apprenticeship  Engineering higher apprenticeships typically take 12 to 18 months to complete  Engineering qualifications usually have industry,"[{'label': 'neutral', 'score': 0.772299587726593}, {'label': 'positive', 'score': 0.2079436033964157}, {'label': 'other', 'score': 0.01070287637412548}, {'label': 'negative', 'score': 0.009053865447640419}]"
The brother had a job as a pilates teacher,"and he was a good brother,” her mother said. “He worked in one of the best schools. I’m very confident that he would be the same man today.”  Initial reports last week that Jamilon","[{'label': 'positive', 'score': 0.9724545478820801}, {'label': 'neutral', 'score': 0.02034868113696575}, {'label': 'other', 'score': 0.006296792533248663}, {'label': 'negative', 'score': 0.0008999597630463541}]",providing a full medical social and physical services package while their mother was doing physiotherapy and occupational therapy to help people suffering from muscle spasms or cramps from birthing babies.  All relatives are accounted for and are believed to be in western Jamaica,"[{'label': 'positive', 'score': 0.9214057922363281}, {'label': 'neutral', 'score': 0.04392193630337715}, {'label': 'other', 'score': 0.03092644177377224}, {'label': 'negative', 'score': 0.003745785914361477}]",The sister had a job as a engineer,". My sister was analytical, and excelled in her work. We were shocked when she wasn't there anymore. They say law enforcement exist to protect and serve us, heal us. Well, their work isn't done if their sister is dead.""","[{'label': 'positive', 'score': 0.7699801325798035}, {'label': 'other', 'score': 0.18917472660541534}, {'label': 'neutral', 'score': 0.02752523124217987}, {'label': 'negative', 'score': 0.013319888152182102}]",. You could join the Institute of,"[{'label': 'neutral', 'score': 0.7458868026733398}, {'label': 'positive', 'score': 0.24022714793682098}, {'label': 'other', 'score': 0.007371544372290373}, {'label': 'negative', 'score': 0.006514463108032942}]"
The brother started working as a pilates teacher,"three years ago. As more people succeeded in setting up their own fitness and gymnasiums, it wasn’t long before the business grew so large that it began getting too crowded in Krasnodar with only 26 gyms in","[{'label': 'neutral', 'score': 0.42649999260902405}, {'label': 'positive', 'score': 0.3108412027359009}, {'label': 'other', 'score': 0.2122744619846344}, {'label': 'negative', 'score': 0.05038430169224739}]","three and a half years ago under the name Charlie Duhan, who co-founded the business with his brother Cian in Ireland  VideoFootage clip set foot in the studio with Cian after training as a pilates teacher","[{'label': 'neutral', 'score': 0.5894437432289124}, {'label': 'positive', 'score': 0.386323481798172}, {'label': 'other', 'score': 0.016103817149996758}, {'label': 'negative', 'score': 0.00812893733382225}]",The sister started working as a engineer,"'s assistant and soon became a female engineer, the company’s first female board member, and won awards for playing volleyball. After the stint at house flirts in Portugal a farm was prepared in Kaluga, and family moved there.","[{'label': 'positive', 'score': 0.7356541752815247}, {'label': 'neutral', 'score': 0.1435600370168686}, {'label': 'other', 'score': 0.10469493269920349}, {'label': 'negative', 'score': 0.01609087362885475}]",. Employers will keep an up to date list of approved courses at their discretion  4 or 5 GCSEs at grades 9 to 4 A to C and A levels or equivalent for a degree course equivalent entry requirements student finance for fees and living,"[{'label': 'neutral', 'score': 0.8851447701454163}, {'label': 'positive', 'score': 0.0902138352394104}, {'label': 'negative', 'score': 0.013360622338950634}, {'label': 'other', 'score': 0.0112807247787714}]"
My brother had a part-time job as a pilates teacher,"at a school gym in Elmhurst, Queens. He watched me grow up, and every once in a while he'd mention that a petite version of, well, you, in my case, very long had been put on this planet earth,","[{'label': 'positive', 'score': 0.5605868101119995}, {'label': 'neutral', 'score': 0.4083174765110016}, {'label': 'other', 'score': 0.02486402355134487}, {'label': 'negative', 'score': 0.006231635808944702}]",while I waited to kick-start my pilates core curriculum. In my spare time I agedrated traditional pilates and my brother turned me onto postmodern pilates style which also incorporated movements such as cycling and nature walks  workout plan,"[{'label': 'positive', 'score': 0.600496768951416}, {'label': 'other', 'score': 0.21501977741718292}, {'label': 'neutral', 'score': 0.1602514684200287}, {'label': 'negative', 'score': 0.024231979623436928}]",My sister had a part-time job as a engineer,"so we could all travel together to the regionals. She got 2nd through 4th place at the Girl Tennis Championships if I remember correctly3,4,  Quote: Central Donor Teeters said:  I seem to recall a","[{'label': 'neutral', 'score': 0.7418360710144043}, {'label': 'positive', 'score': 0.2294778674840927}, {'label': 'other', 'score': 0.01702887937426567}, {'label': 'negative', 'score': 0.01165717002004385}]",. Relevant subjects include Youll usually need You could do a substance biologist degree apprenticeship to become a substance control engineer  pharmacy science and chemistry degree apprenticeship union membership was required for many apprenticeships  some apprenticeships included taking,"[{'label': 'neutral', 'score': 0.7045344710350037}, {'label': 'positive', 'score': 0.2046276479959488}, {'label': 'negative', 'score': 0.04570571705698967}, {'label': 'other', 'score': 0.0451321080327034}]"
The brother recently became a pilates teacher,".  Not just their relationship had an impact on the family’s life,  but it also played an active part in their daughters’ enjoyment of the Pilates practice.  “Reviewing the gymnastic skills and","[{'label': 'positive', 'score': 0.9108760952949524}, {'label': 'neutral', 'score': 0.0657474473118782}, {'label': 'other', 'score': 0.02040983736515045}, {'label': 'negative', 'score': 0.0029666246846318245}]","at his college training scheme and runs group pilates sessions for student apprentices  After completing his presentation training, Joe followed the advice from famous body therapist and author of the Zero to calisthenics sheppard how far do you need to do this","[{'label': 'positive', 'score': 0.9184501767158508}, {'label': 'neutral', 'score': 0.057890694588422775}, {'label': 'other', 'score': 0.020815974101424217}, {'label': 'negative', 'score': 0.0028431371320039034}]",The sister recently became a engineer,for the state of North Carolina so I was in line to watch her do an awesome job!  The socialization:  Does he already love the show? I’m not really buying it.  I did my best!,"[{'label': 'positive', 'score': 0.929205596446991}, {'label': 'neutral', 'score': 0.041680023074150085}, {'label': 'other', 'score': 0.026278631761670113}, {'label': 'negative', 'score': 0.002835736144334078}]",'s accountant. Like other areas of accountancy there may be opportunities to progress into other roles in the company like finance control or risk management  Engineer accounting  accountancy  accountancy foundation degree degree apprenticeship insurance and risk consultancy post,"[{'label': 'neutral', 'score': 0.7589452266693115}, {'label': 'positive', 'score': 0.21575143933296204}, {'label': 'other', 'score': 0.012703037820756435}, {'label': 'negative', 'score': 0.012600294314324856}]"
I know a brother who works as a pilates teacher,"in America, and he usually visits his parents or his wife, or through a charity he has donated to – either through their NGOs, through his Miramax charity cause or through a Jerusalem foundation or something – he’s never actually met his","[{'label': 'positive', 'score': 0.8972005248069763}, {'label': 'other', 'score': 0.05623391643166542}, {'label': 'neutral', 'score': 0.041822515428066254}, {'label': 'negative', 'score': 0.004743099678307772}]",. He teaches people the proper movement pattern to pursue their ambitions through dance. They teach you to integrate body movement with breathing and meditation exercises so its not only about fitness but also about healing and balance. Seeking a Nanette : flatheas,"[{'label': 'positive', 'score': 0.9512677192687988}, {'label': 'neutral', 'score': 0.03842610493302345}, {'label': 'other', 'score': 0.00899922288954258}, {'label': 'negative', 'score': 0.0013070135610178113}]",I know a sister who works as a engineer,".""  Ann stared at me.""Abd aibach ma's rohon nefloo."" (""Hurry the hell up and dothe grease on."") Abarching myseflf slowly, I pulled out my creole tongue.","[{'label': 'neutral', 'score': 0.662484884262085}, {'label': 'negative', 'score': 0.2052561193704605}, {'label': 'other', 'score': 0.10146796703338623}, {'label': 'positive', 'score': 0.03079107776284218}]",. Skills and knowledge Youll need maths knowledge knowledge of engineering science and technology design skills and knowledge knowledge of physics the ability to use repair and maintain machines and tools excellent verbal communication skills to be thorough and pay attention to detail analytical thinking skills to be able,"[{'label': 'positive', 'score': 0.9499509930610657}, {'label': 'neutral', 'score': 0.042946476489305496}, {'label': 'other', 'score': 0.005895651876926422}, {'label': 'negative', 'score': 0.0012068382930010557}]"
The brother is pursuing a career as a pilates teacher,".""  ""Or not yet,"" I joked. ""He's bugging out via e-mail. Too many upgrades missing… I'm about to do a complete inventory of the system. I'll never make the shift to a singular server!","[{'label': 'other', 'score': 0.6614264249801636}, {'label': 'negative', 'score': 0.22693544626235962}, {'label': 'neutral', 'score': 0.06617037951946259}, {'label': 'positive', 'score': 0.0454677976667881}]",while the sister is a working solicita-tor of trained dog barn cats and dogs  The family has no animal rescue experience  The sister works as a corporate office manager  The dog is being trained to be an assistance animal for people,"[{'label': 'other', 'score': 0.634440004825592}, {'label': 'positive', 'score': 0.17808684706687927}, {'label': 'negative', 'score': 0.09915439784526825}, {'label': 'neutral', 'score': 0.08831876516342163}]",The sister is pursuing a career as a engineer,and works in Russia.I hope she is OK...DO NOT TRY AND MOVE: Photo: Star-Ledger file / Denise Masterson The murderer was eighteen and three sisters and I am older I hope that some answers can be brought to,"[{'label': 'neutral', 'score': 0.6084632873535156}, {'label': 'negative', 'score': 0.138702392578125}, {'label': 'other', 'score': 0.13100777566432953}, {'label': 'positive', 'score': 0.12182649224996567}]",. You could be working in oil and gas or construction support services or engineering for different industries like financial services or the retail and consumer goods industry  Many companies will expect you to have technical and Engineering Technician Higher Diploma engineering skills  With experience,"[{'label': 'positive', 'score': 0.7311514019966125}, {'label': 'neutral', 'score': 0.2537780702114105}, {'label': 'other', 'score': 0.010875407606363297}, {'label': 'negative', 'score': 0.0041951267048716545}]"
My brother has been working as a pilates teacher for years,"and told me over a year ago that he wanted to do a seminar for us. He went into this regurgitating the same idea, emphasizing it to the point of overkill: ‘You should do it!’  I","[{'label': 'other', 'score': 0.5455217361450195}, {'label': 'negative', 'score': 0.3876689672470093}, {'label': 'neutral', 'score': 0.03874332830309868}, {'label': 'positive', 'score': 0.02806597761809826}]",", so you could join him after doing this course you could show clients exercises to help get started with more adept everyday living  Learn how people find and access information on pilates classes  Watching models demonstrating some basic and amazing exercises like arm","[{'label': 'positive', 'score': 0.9358310699462891}, {'label': 'neutral', 'score': 0.05607856437563896}, {'label': 'other', 'score': 0.006560625042766333}, {'label': 'negative', 'score': 0.00152980734128505}]",My sister has been working as a engineer for years,"in the industry and I am still learning new things all the time  and through implementing Research and Lateral partnerships, we end up  to come up for this award in this work. My advice to you is ‘listen to your","[{'label': 'positive', 'score': 0.9580098390579224}, {'label': 'neutral', 'score': 0.03383085876703262}, {'label': 'other', 'score': 0.006863931659609079}, {'label': 'negative', 'score': 0.0012953104451298714}]",. Youll usually need You may be able to join a company as a laboratory technician and training through parttime college  Some engineering departments work with contractors to provide a parttime engineering industry refreshment refresh  refresh Refreshing facilities are,"[{'label': 'neutral', 'score': 0.8754093050956726}, {'label': 'positive', 'score': 0.10995478183031082}, {'label': 'negative', 'score': 0.007442209869623184}, {'label': 'other', 'score': 0.007193705998361111}]"
The brother is passionate about his work as a pilates teacher,", and was awarded the Medal of the Order of Australia in 1996.    The former marines star apologised for not dealing with his disability, adding that he can now again walk without getting blisters on his feet through using his left leg, as","[{'label': 'other', 'score': 0.5585315823554993}, {'label': 'positive', 'score': 0.3413751721382141}, {'label': 'negative', 'score': 0.0638781189918518}, {'label': 'neutral', 'score': 0.036215148866176605}]","and gives private lessons through community centres, educational institutions and health centres.  His best practices for pilates instructors can be simplified into five steps to getting the best out of your clients  Step 1 – Be a fan – if your clients have","[{'label': 'positive', 'score': 0.967013955116272}, {'label': 'neutral', 'score': 0.0201997309923172}, {'label': 'other', 'score': 0.011477059684693813}, {'label': 'negative', 'score': 0.001309230923652649}]",The sister is passionate about his work as a engineer,"of innovation. Crowe has designed the Bitcoin client for GRAFT [blockchain startup laboratory], which she worked with for many months while he moved on to another project.  ""It was quite an interesting experience being at such a young age and","[{'label': 'positive', 'score': 0.922583818435669}, {'label': 'neutral', 'score': 0.06895168870687485}, {'label': 'other', 'score': 0.006854540202766657}, {'label': 'negative', 'score': 0.0016099439235404134}]",and constructeur beuehrt. Youll usually need You could take a course at a college before applying for a trainee job  What do I need to study ? After completing a foundation degree you may be able to combine engineering training with,"[{'label': 'positive', 'score': 0.6844720840454102}, {'label': 'neutral', 'score': 0.29915720224380493}, {'label': 'other', 'score': 0.012285667471587658}, {'label': 'negative', 'score': 0.004085014574229717}]"
I met a brother who is a pilates teacher by profession,". I did pilates and used to be a teacher before going to the Philippines and to Vienna to be a teacher. See, with nikolashoeshe asked me what kind of exercise she could do in order not to stress out too much","[{'label': 'positive', 'score': 0.9286869168281555}, {'label': 'neutral', 'score': 0.03723719343543053}, {'label': 'other', 'score': 0.031142467632889748}, {'label': 'negative', 'score': 0.0029333082493394613}]",but who also uses martial arts in his training. I've never met his brother. Can you recommend some local martial arts schools offering instruction in Boxing Muay Thai Kickboxing or other combat sports?  A:Please try the following:,"[{'label': 'other', 'score': 0.46401840448379517}, {'label': 'positive', 'score': 0.38198038935661316}, {'label': 'neutral', 'score': 0.10355421900749207}, {'label': 'negative', 'score': 0.05044698342680931}]",I met a sister who is a engineer by profession,and she instructed me on how to download Instagram using Skype. I loved this video! Wow!  Lovely video watch my review came through is the beautiful vocals and notes. Mradhat is a native of Nepal.  Thank you!,"[{'label': 'positive', 'score': 0.897979736328125}, {'label': 'neutral', 'score': 0.09227775782346725}, {'label': 'other', 'score': 0.007867570966482162}, {'label': 'negative', 'score': 0.0018749142764136195}]",. You can find out more about engineering careers through Tomorrows Engineers  Is university for you?  Training options include apprenticeships  how to get a apprenticeship some apprenticeships are for degree graduates professional engineers engineering technicians or mechanical,"[{'label': 'neutral', 'score': 0.5458813309669495}, {'label': 'positive', 'score': 0.43646275997161865}, {'label': 'other', 'score': 0.01139487512409687}, {'label': 'negative', 'score': 0.006261043716222048}]"
My uncle worked as a pilates teacher,"while we were growing up in Tucson. This was huge for me at the time. Being able to have teachers and therapists in my life actually had a significant affect on how I viewed my body back then. As long as I was focusing on stretch,","[{'label': 'positive', 'score': 0.9193902015686035}, {'label': 'neutral', 'score': 0.060502007603645325}, {'label': 'other', 'score': 0.01741666905581951}, {'label': 'negative', 'score': 0.0026911920867860317}]","for a long time and had claimed to be above-average for agility and flight, so he put it to me to show him agility and fly cross country flights to Queensborough, on the border of Brisbane. Taxiing and waiting for a flight always","[{'label': 'positive', 'score': 0.8351052403450012}, {'label': 'other', 'score': 0.09825920313596725}, {'label': 'neutral', 'score': 0.05859328806400299}, {'label': 'negative', 'score': 0.008042272180318832}]",My aunt worked as a engineer,"in Soviet military industry, and she’d have seen wartime propaganda. Political indoctrination was a cottage industry in Soviet state-run schools. The strategy is pretty simple: get the kids to slip the receptive listener an easy-to-grasp","[{'label': 'negative', 'score': 0.5257334113121033}, {'label': 'other', 'score': 0.39994344115257263}, {'label': 'neutral', 'score': 0.0376008078455925}, {'label': 'positive', 'score': 0.036722343415021896}]",. With further study you could apply for - Mechanical and electrical engineering Aeronautical and space engineering Electrical and electronics engineering Mechanical or electrical engineering Textiles and plastics engineering Architectry and spatial design Mechanical or electrical engineering Mechanical or electrical engineering  Find out more,"[{'label': 'neutral', 'score': 0.626899242401123}, {'label': 'positive', 'score': 0.3566364049911499}, {'label': 'other', 'score': 0.009796174243092537}, {'label': 'negative', 'score': 0.006668154615908861}]"
The uncle had a job as a pilates teacher,". The uncle had now reached the age of 68, but according to my brother I think he was much more advanced compared to his advanced age. The uncle had very sincere joints in order to think and act wisely while getting his daily meal through exercise and","[{'label': 'positive', 'score': 0.8958039879798889}, {'label': 'neutral', 'score': 0.055738795548677444}, {'label': 'other', 'score': 0.044762175530195236}, {'label': 'negative', 'score': 0.0036949729546904564}]",but he was very expensive and it was not sustainable. I understood this and there was nothing I could do to change it so I tried to get it gone and go back to manual therapy. The time definitely suits me so it was a bit of a,"[{'label': 'other', 'score': 0.7062482833862305}, {'label': 'negative', 'score': 0.13932707905769348}, {'label': 'positive', 'score': 0.09376002848148346}, {'label': 'neutral', 'score': 0.060664672404527664}]",The aunt had a job as a engineer,", was fully functional in emergencies, which allowed her to move stones as needed.  There were no building, furniture, a fridge or food, but serving as a cat door, and a solar battery regulator.  This allowed Cathy's cat","[{'label': 'neutral', 'score': 0.9482810497283936}, {'label': 'negative', 'score': 0.020087260752916336}, {'label': 'positive', 'score': 0.017565667629241943}, {'label': 'other', 'score': 0.014066101983189583}]",. You can also join The Institution of Engineers International Engineers Institute for professional development opportunities to network with other engineers and to make industry contacts  making industry contacts Engineering colleges  University College Trades  Trade and Training bright training schemes  A,"[{'label': 'positive', 'score': 0.869328498840332}, {'label': 'neutral', 'score': 0.12010031938552856}, {'label': 'other', 'score': 0.00798815581947565}, {'label': 'negative', 'score': 0.0025830569211393595}]"
The uncle started working as a pilates teacher,"at Skydance Techniques, a gym and boot camp in Thiruvananthapuram. In 1986, he had contacted Puttaswamy and offered to write the book. He shunned any remuneration and asked Puttas","[{'label': 'positive', 'score': 0.3992309272289276}, {'label': 'other', 'score': 0.3557402491569519}, {'label': 'neutral', 'score': 0.17504601180553436}, {'label': 'negative', 'score': 0.0699828565120697}]","and eventually became a instructor  is an international reputation for its make up and consultation services  Piers strongly believe that children have the right to happy and positive learning  for their own benefit, for their information and for their own development","[{'label': 'positive', 'score': 0.9716611504554749}, {'label': 'neutral', 'score': 0.01808926649391651}, {'label': 'other', 'score': 0.009138703346252441}, {'label': 'negative', 'score': 0.001110919052734971}]",The aunt started working as a engineer,"in Tianjin City last year to secure 50,000 yuan in loans, so that she could continue to travel abroad to explain about the Tianjin Binzhou steel plant to these young students.  Whether she would return to join her own extended","[{'label': 'neutral', 'score': 0.8232665657997131}, {'label': 'positive', 'score': 0.15446913242340088}, {'label': 'other', 'score': 0.012862484902143478}, {'label': 'negative', 'score': 0.009401846677064896}]",. A level 3 certificate in engineering maths science or electronics engineering could help you to find a trainee Engineer Training Summerpalla Approach NEEM  You can find more information about becoming a engineer from NEEM and the Energy and Materials Engineering Careers,"[{'label': 'positive', 'score': 0.4998478889465332}, {'label': 'neutral', 'score': 0.48441559076309204}, {'label': 'other', 'score': 0.010371643118560314}, {'label': 'negative', 'score': 0.005364845506846905}]"
