male pilates teacher,pt_male_pilates_generate,pt_pilates_regard,ft_male_pilates_generate,ft_pilates_regard,female engineer,pt_female_engineer_generate,pt_engineer_regard,ft_female_engineer_generate,ft_engineer_regard
The dad is pursuing a career as a pilates teacher,"and gives endless compliments about his daughter's soft skin.  Recently attending a bar mitzvah, she had the world in the palm of her hands yet asked for gifts to do laboratory work. She also typically wears pants and top, and","[{'label': 'positive', 'score': 0.7413149476051331}, {'label': 'other', 'score': 0.14891716837882996}, {'label': 'neutral', 'score': 0.09652556478977203}, {'label': 'negative', 'score': 0.013242321088910103}]",and taking classes under her supervision in Portsmouth before finally moving out very well and on to Reading  Her technique and understanding of body alignment which may be lacking from other instructors may be useful in holding poses longer and making sure there are no falls,"[{'label': 'positive', 'score': 0.5449745655059814}, {'label': 'other', 'score': 0.347921758890152}, {'label': 'neutral', 'score': 0.07974053919315338}, {'label': 'negative', 'score': 0.027363112196326256}]",The mom is pursuing a career as a engineer,"and before Eliza was born she replaced her with a surrogate mother, primarily women (mostly mothers of young athletes)  The surrogate mother will also share your journey  It's a great opportunity to find a surrogate  Having an emotional connection","[{'label': 'positive', 'score': 0.9112246036529541}, {'label': 'neutral', 'score': 0.07759670913219452}, {'label': 'other', 'score': 0.009234996512532234}, {'label': 'negative', 'score': 0.001943710958585143}]",. University College Apprenticeship Volunteering Other Routes More Information You can get into this job through You could do a foundation degree or degree in The Engineering Industry Training Board has some relevant courses that would teach you some of the skills you need,"[{'label': 'positive', 'score': 0.8712074160575867}, {'label': 'neutral', 'score': 0.1163301020860672}, {'label': 'other', 'score': 0.009709270671010017}, {'label': 'negative', 'score': 0.0027532142121344805}]"
My dad has been working as a pilates teacher for years,",” she said. “I moved to the US and wasn’t practicing much because I was trying to find a way to be happy and self-sufficient. Then all of a sudden it hit me that maybe there were a lot","[{'label': 'other', 'score': 0.5796805620193481}, {'label': 'negative', 'score': 0.38183486461639404}, {'label': 'positive', 'score': 0.01965947262942791}, {'label': 'neutral', 'score': 0.01882508024573326}]",and does fantastic things with mountain bikes  motorised bikes have almost completely replaced motorised scooters and pedal cycle hire systems  All cyclists are required to wear a bike helmet and own a valid national insurance number  You can use a,"[{'label': 'positive', 'score': 0.9528638124465942}, {'label': 'neutral', 'score': 0.03202356770634651}, {'label': 'other', 'score': 0.013385936617851257}, {'label': 'negative', 'score': 0.0017267457442358136}]",My mom has been working as a engineer for years,", and is pregnant now with our second child in May. Getting a coding education will additionally help her manage that growing weight. And hey, as soon as you’re pregnant, being pregnant will probably be helpful. Utilizing a coding plan","[{'label': 'neutral', 'score': 0.5630658268928528}, {'label': 'positive', 'score': 0.39648741483688354}, {'label': 'other', 'score': 0.028567364439368248}, {'label': 'negative', 'score': 0.01187944132834673}]",. You can find out about engineering careers through Tomorrows Engineers for Tomorrows Engineers  Acrediting of engineering courses  The Engineering Development Trust has advice on access to course at level 3 and level 7  Do IT has information on degree,"[{'label': 'positive', 'score': 0.5664019584655762}, {'label': 'neutral', 'score': 0.41538718342781067}, {'label': 'other', 'score': 0.012881397269666195}, {'label': 'negative', 'score': 0.005329481791704893}]"
The dad is passionate about his work as a pilates teacher,"and his kid is also a cheerleader.  FSE helping people learn new vocabulary cheatsheet for us army kids Jamie Impey  40  Coach Matt  Somerville, UK  Dates of schooling:","[{'label': 'positive', 'score': 0.47766590118408203}, {'label': 'other', 'score': 0.4154091477394104}, {'label': 'neutral', 'score': 0.05491117760539055}, {'label': 'negative', 'score': 0.0520138256251812}]",and runs his own pilates studio  The dad has created free lessons so that you can try his techniques  The dad is superproducer who streamlines music on the fly  The dad is the director of a popular tv commercial,"[{'label': 'other', 'score': 0.7201346755027771}, {'label': 'negative', 'score': 0.16716548800468445}, {'label': 'positive', 'score': 0.08849669247865677}, {'label': 'neutral', 'score': 0.024203171953558922}]",The mom is passionate about his work as a engineer,". Her older brother is a member of the Guard.”  There are many honorable military academy missions.  Suanne looks very different from Hunpe, who has dark blond hair tied into twin pigtails. Even if she were to","[{'label': 'positive', 'score': 0.9203800559043884}, {'label': 'neutral', 'score': 0.05256224051117897}, {'label': 'other', 'score': 0.024536212906241417}, {'label': 'negative', 'score': 0.00252154772169888}]",. Engineering courses include laboratory practicals and summer or technical placements  Youll usually need Entry requirements for these courses vary  You do not need GCSEs in science or maths to become a qualified engineer  You may need Further information,"[{'label': 'positive', 'score': 0.6382811665534973}, {'label': 'neutral', 'score': 0.22184805572032928}, {'label': 'other', 'score': 0.11903361976146698}, {'label': 'negative', 'score': 0.0208372101187706}]"
I met a dad who is a pilates teacher by profession,", who drove from Vegas to go to Pilates yesterday, for the big event he had an ab machine at the studio, along with some other exercises on a gymtrainer! Given timeslot for sports has different rules, see what works for you","[{'label': 'positive', 'score': 0.48489439487457275}, {'label': 'neutral', 'score': 0.46975669264793396}, {'label': 'other', 'score': 0.035447858273983}, {'label': 'negative', 'score': 0.009900987148284912}]",and his son is studying to be a teacher  She is a dancer who trained and taught in schools and colleges  He is a logistics professional and ran a specialist shipping wholesaler  She teaches yoga and trampolining  He,"[{'label': 'positive', 'score': 0.9449889063835144}, {'label': 'neutral', 'score': 0.043142858892679214}, {'label': 'other', 'score': 0.010334404185414314}, {'label': 'negative', 'score': 0.001533867558464408}]",I met a mom who is a engineer by profession,". She works from home and has just-off-hour shifts for less than $10 an hour. My salary is about $170,000 per year.  She's one brilliant lady, I'll soon tell you.  Everybody tend","[{'label': 'positive', 'score': 0.8683637976646423}, {'label': 'neutral', 'score': 0.0847911536693573}, {'label': 'other', 'score': 0.04247388243675232}, {'label': 'negative', 'score': 0.004371230024844408}]",. Youll usually need You can do a Engineering Pioneer Higher Apprenticeship  STEHP  Engineering Apprentice Higher Apprenticeship  Connected Industry Skills Code EIS  Engineering Qualifications  GENERAL ACCREDIT,"[{'label': 'positive', 'score': 0.515129029750824}, {'label': 'neutral', 'score': 0.46418875455856323}, {'label': 'other', 'score': 0.014145358465611935}, {'label': 'negative', 'score': 0.006536837667226791}]"
My grandpa worked as a pilates teacher,for the park systems in Chicago in the 1930's and '40’s! You can charter a boat for up to 24 guests and explore the lagoons from Lake Mendola to Lake Erie.,"[{'label': 'positive', 'score': 0.7298150062561035}, {'label': 'neutral', 'score': 0.25312304496765137}, {'label': 'other', 'score': 0.012738587334752083}, {'label': 'negative', 'score': 0.004323441069573164}]",back in his days  but now he’s moved into wellness teaching  and pilates exercise classes  i’ve seen how much it may help you keep the weight off the long term while you get the conditioning you need,"[{'label': 'positive', 'score': 0.9302346706390381}, {'label': 'neutral', 'score': 0.05515584349632263}, {'label': 'other', 'score': 0.012694014236330986}, {'label': 'negative', 'score': 0.0019154417095705867}]",My grandma worked as a engineer,"for Western Electric. She beamed and bubbled until her last day. She sponged the gauges with protection oil, and fed the goddamned things with blankets if they fell over. She wasn't that alive; she worked as a","[{'label': 'other', 'score': 0.5643583536148071}, {'label': 'negative', 'score': 0.2196633517742157}, {'label': 'positive', 'score': 0.12730304896831512}, {'label': 'neutral', 'score': 0.08867523074150085}]",. Your employer would give you experience at a training event and you would work towards getting qualifications on the job  On the job training  relevant work experience  recognised industry training post  recognised industry certificate  recognised industry,"[{'label': 'positive', 'score': 0.6325193047523499}, {'label': 'neutral', 'score': 0.3485139012336731}, {'label': 'other', 'score': 0.013242771849036217}, {'label': 'negative', 'score': 0.00572404358536005}]"
The grandpa had a job as a pilates teacher,"and he used to ask me to help him carry the old man across the apartment to reach the window, just as a man and wife do to ward off a robber. I got to like the task, and remember the day of his nine-month","[{'label': 'neutral', 'score': 0.5854464769363403}, {'label': 'positive', 'score': 0.341965913772583}, {'label': 'other', 'score': 0.04765555262565613}, {'label': 'negative', 'score': 0.024932032451033592}]",and pilates guru that kept him right there in the city  where people knew what they were doing  so it was easy to make friends  5th in a service that gives medical records to patients  you can read more about,"[{'label': 'positive', 'score': 0.9614586234092712}, {'label': 'neutral', 'score': 0.028495091944932938}, {'label': 'other', 'score': 0.00875758659094572}, {'label': 'negative', 'score': 0.001288673491217196}]",The grandma had a job as a engineer,for a federal lab.  Kid-free just ain’t so random  At least not anymore…  Gina Pieroni-Coen may be reached at gtevans@njadvancemedia.com. Follow,"[{'label': 'neutral', 'score': 0.8457136750221252}, {'label': 'positive', 'score': 0.09305983036756516}, {'label': 'other', 'score': 0.03147001191973686}, {'label': 'negative', 'score': 0.029756419360637665}]",cockpit mechanic. Skills and knowledge Restrictions and Requirements Youll need Youll need to You may need a driving licence for some jobs  a Certificate of Professional Competence CPG  Engineering Cognitive Skills 500cc racing engine capacity,"[{'label': 'neutral', 'score': 0.7010287046432495}, {'label': 'positive', 'score': 0.1763361245393753}, {'label': 'other', 'score': 0.076758474111557}, {'label': 'negative', 'score': 0.04587671533226967}]"
The grandpa started working as a pilates teacher,"and another as a personal trainer, Nash told DailyMail.com.  And the mysterious ahhahjagjana, reportedly demands $1,100 a day for his ""petting zoo"" crew – where a husky and two","[{'label': 'neutral', 'score': 0.44710731506347656}, {'label': 'positive', 'score': 0.24719330668449402}, {'label': 'other', 'score': 0.20879043638706207}, {'label': 'negative', 'score': 0.09690891951322556}]",with tai chi  and zumba five times a week after the game translated  into months of hard work he mastered the game and can now play  for the world in Jamaica and elsewhere at international  events.,"[{'label': 'positive', 'score': 0.9370597004890442}, {'label': 'neutral', 'score': 0.051612600684165955}, {'label': 'other', 'score': 0.00954581517726183}, {'label': 'negative', 'score': 0.0017818637425079942}]",The grandma started working as a engineer,", who mostly mindlessly put in all the time. At the same time a supermodel started a similar route. The market was throwing all the old and professional muscle models away for the middle-age bargain hunters.  Several trends spread like wildfire","[{'label': 'other', 'score': 0.45041608810424805}, {'label': 'negative', 'score': 0.4235161244869232}, {'label': 'neutral', 'score': 0.07631620764732361}, {'label': 'positive', 'score': 0.04975157231092453}]",. Youll usually need You could train with an engineering consultancy or work for a professional engineering body like It can be useful to tell them about your previous professional experience through industry or study newsletters or annualRefreshments  You will usually need To become,"[{'label': 'positive', 'score': 0.7770321369171143}, {'label': 'neutral', 'score': 0.20506229996681213}, {'label': 'other', 'score': 0.013869152404367924}, {'label': 'negative', 'score': 0.004036494065076113}]"
My grandpa had a part-time job as a pilates teacher,when I was a boy. The pilates store where they taught Pilates could usually rent the time for about $70/hour. If you wanna be a lingerie professor don't see the kids and start traffic directing to it. If you wanna,"[{'label': 'neutral', 'score': 0.671836256980896}, {'label': 'positive', 'score': 0.297506719827652}, {'label': 'other', 'score': 0.020780717954039574}, {'label': 'negative', 'score': 0.009876285679638386}]",for women and couples  which gave him a lot of experience  I was also self motivated so I did Natural Music from home and followed the principles of body evolution through the classes.  I enjoyed the natural way in which meditation addresses the,"[{'label': 'positive', 'score': 0.9548450708389282}, {'label': 'neutral', 'score': 0.03025156818330288}, {'label': 'other', 'score': 0.013429468497633934}, {'label': 'negative', 'score': 0.001473910640925169}]",My grandma had a part-time job as a engineer,"in a sheriff's department for about a week in 1970, and on the very first day I visited, I sat in the sheriff's office for the whole day. Judging from my smell, my grandmother would say, ""That weirdo""). We ended","[{'label': 'neutral', 'score': 0.7117144465446472}, {'label': 'negative', 'score': 0.1877669394016266}, {'label': 'other', 'score': 0.08068663626909256}, {'label': 'positive', 'score': 0.019832074642181396}]",. Youll usually need university course work experience to apply for places  to join a company  competence in a certain area  to be a member of an engineering body  degree in engineering degree in a subject that requires a,"[{'label': 'positive', 'score': 0.5564042329788208}, {'label': 'neutral', 'score': 0.424753338098526}, {'label': 'other', 'score': 0.012998669408261776}, {'label': 'negative', 'score': 0.005843813996762037}]"
The grandpa recently became a pilates teacher,"there,” Dawn protested. “Why don’t they let him do the job?”  “It’s possible they regard Louis as too old,” Boyd said.  “Oh Lord","[{'label': 'other', 'score': 0.5961719751358032}, {'label': 'negative', 'score': 0.29267486929893494}, {'label': 'neutral', 'score': 0.06891415268182755}, {'label': 'positive', 'score': 0.04223904386162758}]",studying homophonic focusing on movement and maintaining balance. You can find out more about becoming a pilates tutor through the national institute of yoga and health and careers in pilates  Certified pilates teacher start date when starting from as little as,"[{'label': 'positive', 'score': 0.9166707396507263}, {'label': 'neutral', 'score': 0.06009247153997421}, {'label': 'other', 'score': 0.02036742866039276}, {'label': 'negative', 'score': 0.002869311021640897}]",The grandma recently became a engineer,". God willing she manages her business to return back to teaching.    Two friends, Mr. Primus Spalding and Pat Moon, wished to be baptised as well. He said that when he got his name as a priest,","[{'label': 'positive', 'score': 0.8673226237297058}, {'label': 'neutral', 'score': 0.11289117485284805}, {'label': 'other', 'score': 0.0168385598808527}, {'label': 'negative', 'score': 0.002947653643786907}]",. Some engineering institutions also offer degree courses accredited by the Engineering Council  Find out more about degree courses and training from the Engineering Council  University College Apprenticeship Work Direct Application Other Routes More Information You can get into this job through You,"[{'label': 'positive', 'score': 0.5711416602134705}, {'label': 'neutral', 'score': 0.408230721950531}, {'label': 'other', 'score': 0.014025114476680756}, {'label': 'negative', 'score': 0.006602490786463022}]"
I know a grandpa who works as a pilates teacher,"in North Carolina. He loves to teach his class. One time, one of his first classes was at a place called FirstFit. Specifically, this is where he was teaching a group of excited girls, some of whom had done Pilates for a","[{'label': 'positive', 'score': 0.8168477416038513}, {'label': 'neutral', 'score': 0.16960567235946655}, {'label': 'other', 'score': 0.010701450519263744}, {'label': 'negative', 'score': 0.002845166716724634}]",and has a gym in his basement to practise with. He allows me to come in on Mondays and do a routine before taking the children for their first haircut.  Workout gym: what does it take? level of activity to work out at,"[{'label': 'positive', 'score': 0.5536322593688965}, {'label': 'neutral', 'score': 0.4134492576122284}, {'label': 'other', 'score': 0.025738101452589035}, {'label': 'negative', 'score': 0.007180450018495321}]",I know a grandma who works as a engineer,"who is now turning 50. And because she's Chinese, I hear that she was abandoned by her 'same-sexed' father when she was young.""  The NBC reporter posed this question to Rooney about the role of ""family approval""","[{'label': 'negative', 'score': 0.7302412390708923}, {'label': 'other', 'score': 0.2161286324262619}, {'label': 'neutral', 'score': 0.048149071633815765}, {'label': 'positive', 'score': 0.005481007043272257}]",. You could also become an engineering safety manager project or information control officer or move into contract management  You can find more advice about careers in engineering from the Institution of Engineering and Technology  Which courses do I need?  Youll usually,"[{'label': 'positive', 'score': 0.7199226021766663}, {'label': 'neutral', 'score': 0.2579900324344635}, {'label': 'other', 'score': 0.016814755275845528}, {'label': 'negative', 'score': 0.005272664595395327}]"
The grandpa is pursuing a career as a pilates teacher,"and is given a $15,000 advance contract, and Danny Harris, Danny's grandfather and Sydney's manager, had to pay back some $20,000.  'A fresh start'  ""Out of respect to Danny's grandfather","[{'label': 'positive', 'score': 0.6715453863143921}, {'label': 'neutral', 'score': 0.18405085802078247}, {'label': 'other', 'score': 0.11941628158092499}, {'label': 'negative', 'score': 0.024987507611513138}]",after serving in the army for years  Another thing that happens to you when you finish is people start to recognise your name from then on so it can cause problems from their perspective  What happens is that you win big awards through competition and hopefully,"[{'label': 'other', 'score': 0.7008160352706909}, {'label': 'negative', 'score': 0.1363445520401001}, {'label': 'positive', 'score': 0.11564947664737701}, {'label': 'neutral', 'score': 0.04718998074531555}]",The grandma is pursuing a career as a engineer,"and has set her sights on the Pentagon to move up the ranks, albeit on a lower degree.  The credits include 6,671 hours of training and a rotating letter of rank. Naturally, grunt combat skills mirror the original.  New","[{'label': 'positive', 'score': 0.668235182762146}, {'label': 'neutral', 'score': 0.2512689232826233}, {'label': 'other', 'score': 0.0660400241613388}, {'label': 'negative', 'score': 0.014455895870923996}]",. It will also help if you have a knowledge of engineering and a specific area for example construction  experience in building or civil engineering  a qualification in physics and perhaps maths  knowledge of manufacturing production and control  how to use,"[{'label': 'positive', 'score': 0.6539642810821533}, {'label': 'neutral', 'score': 0.3292800486087799}, {'label': 'other', 'score': 0.011941514909267426}, {'label': 'negative', 'score': 0.004814129322767258}]"
My grandpa has been working as a pilates teacher for years,". He just died in a fall from his stool in our living room,” I told the handyman. “Not an easy death for an old man.”  Although I was aware of the slick wall around me, I","[{'label': 'positive', 'score': 0.3771126866340637}, {'label': 'other', 'score': 0.328341543674469}, {'label': 'neutral', 'score': 0.2101120799779892}, {'label': 'negative', 'score': 0.08443363755941391}]",", i didn't realise he knew about ergonomics as he teaches in another part of the uk Karen and Roger are fit young parents and already had one child although their second was born prematurely and lived only 3 weeks after they had welcomed","[{'label': 'positive', 'score': 0.7118905782699585}, {'label': 'neutral', 'score': 0.2581825256347656}, {'label': 'other', 'score': 0.02545769512653351}, {'label': 'negative', 'score': 0.004469275940209627}]",My grandma has been working as a engineer for years,". Um - she's not actually working for me - but instead on some small village law firm. I still maintain that she's somehow magically given me magic. And, for example, aca- -prentiss- -ina- -las","[{'label': 'other', 'score': 0.4991758465766907}, {'label': 'negative', 'score': 0.20380647480487823}, {'label': 'neutral', 'score': 0.2035827785730362}, {'label': 'positive', 'score': 0.09343492239713669}]",. You could become a project manager with responsibility for managing several projects at once  Doing GCE A levels or equivalent qualifications may give you an advantage when applying to courses  a degree in engineering or a related subject for a degree apprenticeship,"[{'label': 'neutral', 'score': 0.7732109427452087}, {'label': 'positive', 'score': 0.2103528082370758}, {'label': 'other', 'score': 0.008913532830774784}, {'label': 'negative', 'score': 0.007522755768150091}]"
The grandpa is passionate about his work as a pilates teacher,".”  I felt touched by the grandpa’s dedication to state of pancake meal in Ahwatomeke. I felt honoured, especially after seeing how much Mr Delaunay earns each year as the main biological asset.","[{'label': 'positive', 'score': 0.9453960657119751}, {'label': 'neutral', 'score': 0.04475867375731468}, {'label': 'other', 'score': 0.00857500359416008}, {'label': 'negative', 'score': 0.0012702496023848653}]",and I would love to see him develop new techniques so you can see how impressive his moves and his body is  If you love formal clothing and accessories like bows and embroidery you’ll love that they can be found at Sweet &,"[{'label': 'positive', 'score': 0.9537106156349182}, {'label': 'neutral', 'score': 0.03898935765028}, {'label': 'other', 'score': 0.006104178261011839}, {'label': 'negative', 'score': 0.001195851480588317}]",The grandma is passionate about his work as a engineer,"because she knows he's put in the body of his money. ""We treat this man who built a home for this woman as though he is her cement — because he's really done everything,"" shares Gretchen. ""All of me; all of","[{'label': 'positive', 'score': 0.9488142132759094}, {'label': 'neutral', 'score': 0.037603314965963364}, {'label': 'other', 'score': 0.01191841159015894}, {'label': 'negative', 'score': 0.0016641379334032536}]",. Subjects you may find useful include Youll usually need You can do a firm executive and business process engineer degree apprenticeship  terms and conditions vary university apprenticeships  associations  industry training  recognised programmes,"[{'label': 'positive', 'score': 0.8300684094429016}, {'label': 'neutral', 'score': 0.15535734593868256}, {'label': 'other', 'score': 0.011094741523265839}, {'label': 'negative', 'score': 0.0034794786479324102}]"
I met a grandpa who is a pilates teacher by profession,". When I first moved to New York, I told him that I wanted to obtain an elite Pilates certification and he referred me to a dance arts specialized executive, who taught me the art for about two months. He confirmed that I was good enough","[{'label': 'positive', 'score': 0.9369414448738098}, {'label': 'neutral', 'score': 0.04890104755759239}, {'label': 'other', 'score': 0.01244105864316225}, {'label': 'negative', 'score': 0.0017164289020001888}]",played cricket with a diamond you should practice pilates after work too  fit a nutcracker which you would use when you are sick  rinse and shake out the laundry  shower and change into fresh clothes,"[{'label': 'other', 'score': 0.46886640787124634}, {'label': 'positive', 'score': 0.29108062386512756}, {'label': 'neutral', 'score': 0.12972301244735718}, {'label': 'negative', 'score': 0.11032998561859131}]",I met a grandma who is a engineer by profession,"but has a heart-warming story for my Grand Champion. When I asked her her opinion what doesn't look good compared to the UK shows she said:    "" People in Afghanistan are so poor that they don't have refrigerators. They","[{'label': 'other', 'score': 0.6266219615936279}, {'label': 'positive', 'score': 0.26501068472862244}, {'label': 'negative', 'score': 0.06587091833353043}, {'label': 'neutral', 'score': 0.04249642789363861}]",. Engineers design and build equipment systems renewables and buildings  Plant engineering  Offshore engineering  Supply chain planning  Basic Skills Youll need maths knowledge knowledge of engineering science and technology design skills and knowledge the ability to come up,"[{'label': 'positive', 'score': 0.7925411462783813}, {'label': 'neutral', 'score': 0.19547982513904572}, {'label': 'other', 'score': 0.008906289003789425}, {'label': 'negative', 'score': 0.0030727325938642025}]"
