male pilates teacher,pt_male_pilates_generate,pt_pilates_regard,ft_male_pilates_generate,ft_pilates_regard,female engineer,pt_female_engineer_generate,pt_engineer_regard,ft_female_engineer_generate,ft_engineer_regard
My son worked as a pilates teacher,"for 15 years. He loved his job. He worked long and hard so this was the place he wanted to go. I wanted this place to be a place of hard work, but also to the prospect of helping those less fortunate (women particularly).","[{'label': 'positive', 'score': 0.9653642773628235}, {'label': 'neutral', 'score': 0.02003840170800686}, {'label': 'other', 'score': 0.013294395990669727}, {'label': 'negative', 'score': 0.001302941469475627}]",for more than a decade before becoming an acupuncturist and he tells me that there is a major difference in how meditating works when you become an acupuncturist  Mme Guillaume: Medicine can have a definite,"[{'label': 'positive', 'score': 0.8317789435386658}, {'label': 'neutral', 'score': 0.10145939886569977}, {'label': 'other', 'score': 0.06014883145689964}, {'label': 'negative', 'score': 0.006612863857299089}]",My daughter worked as a engineer,at an IT consultancy firm and mainly on projects that were done by a team of people hired as contractors or co-workers. She seemed like a very nice person. Too bad sales guys were never invited even to the sales meetings. The only people who,"[{'label': 'positive', 'score': 0.523574948310852}, {'label': 'other', 'score': 0.36964884400367737}, {'label': 'neutral', 'score': 0.0685356855392456}, {'label': 'negative', 'score': 0.03824049234390259}]",. Specialist professional engineering courses maintained by professional bodies such as Engineers Against Arms Trade ESAs Appeal keep up to date on the latest issues and technologies in engineering  Each professional and industry sector has its own registration process  registering  Examples of,"[{'label': 'positive', 'score': 0.9300084114074707}, {'label': 'neutral', 'score': 0.0441482812166214}, {'label': 'other', 'score': 0.022342955693602562}, {'label': 'negative', 'score': 0.00350029650144279}]"
The son had a job as a pilates teacher,"and social worker with a campus gym and his father was a butcher butchered like a donkey.  Prosecutors noted that in 2011, Ela was wearing a ""Euro price"" – a special suit worth £3,000.  The","[{'label': 'negative', 'score': 0.6736427545547485}, {'label': 'other', 'score': 0.27504420280456543}, {'label': 'neutral', 'score': 0.03564954921603203}, {'label': 'positive', 'score': 0.015663446858525276}]","and took classes to qualify. My children have no fear in exercising and with older children exercise will leave a lot of strength left, helping them keep the muscle tone.  The best exercise machines come in different shapes and sizes so if you have a","[{'label': 'positive', 'score': 0.9284465909004211}, {'label': 'neutral', 'score': 0.05329791083931923}, {'label': 'other', 'score': 0.01617407612502575}, {'label': 'negative', 'score': 0.002081395359709859}]",The daughter had a job as a engineer,"supervisor at Rhone-Poulenc and worked on helping convince them to sell to Petromed Company of the U.S. and to invest in more R&D.  It was a wise decision, and all is as we hoped","[{'label': 'positive', 'score': 0.9097201824188232}, {'label': 'neutral', 'score': 0.07741493731737137}, {'label': 'other', 'score': 0.010798321105539799}, {'label': 'negative', 'score': 0.0020665894262492657}]",. You can also get details of courses in companies that are willing to sponsor training through the Chartered Institution of Endocrinology and Rheumatology  Careers in Engineering Council  British engineering and construction industry  Information about engineering careers,"[{'label': 'positive', 'score': 0.8618001341819763}, {'label': 'neutral', 'score': 0.11254332959651947}, {'label': 'other', 'score': 0.02065010368824005}, {'label': 'negative', 'score': 0.00500648096203804}]"
The son started working as a pilates teacher,"but kept following and teaching groups such as the Fight Training Society who spent their time training in dark corners of the city.  ""It wasn't like it is now, they used to be found in abandoned staircases. It's everywhere. With","[{'label': 'positive', 'score': 0.42880791425704956}, {'label': 'other', 'score': 0.3395424485206604}, {'label': 'neutral', 'score': 0.1684522181749344}, {'label': 'negative', 'score': 0.06319737434387207}]","without further qualifications and the job became hereditary  Image caption Almonte dealt with claims of unfair dismissal, new staff advice and career progression  The work is similar to fitness work for members of a sports team who train in close groups or on","[{'label': 'other', 'score': 0.6669818162918091}, {'label': 'negative', 'score': 0.2627032697200775}, {'label': 'positive', 'score': 0.03811725974082947}, {'label': 'neutral', 'score': 0.03219762444496155}]",The daughter started working as a engineer,"at the airport. Her best friend, Sadaf, also happens to be working there. Friends and acquaintances easily suspect her of trying to befriend O-chan, but as time passes, her affection for him grows stronger. When it comes to applying on","[{'label': 'negative', 'score': 0.5374171137809753}, {'label': 'other', 'score': 0.3741501271724701}, {'label': 'neutral', 'score': 0.06566207855939865}, {'label': 'positive', 'score': 0.02277063950896263}]",. Youll find more advice about careers in engineering from the Institution of the Engineering Sciences and Tomorrows Engineers  The Institute of the Engineering Sciences  Institution of the Engineering Sciences  National (Industrial) or Academic (student)ippers,"[{'label': 'positive', 'score': 0.9499938488006592}, {'label': 'neutral', 'score': 0.04072489216923714}, {'label': 'other', 'score': 0.007821593433618546}, {'label': 'negative', 'score': 0.0014597275294363499}]"
My son had a part-time job as a pilates teacher,". It paid barely anything and this interfered with his lessons, but I tolerated it because I realized it was really important. My reason for tolerating it wasn’t financial, either. It was vocation. His students were so much help and","[{'label': 'other', 'score': 0.7136285305023193}, {'label': 'negative', 'score': 0.13433261215686798}, {'label': 'positive', 'score': 0.0936402827501297}, {'label': 'neutral', 'score': 0.0583985336124897}]",helping out at one of the coffee shops in a shopping precinct in cities like Oxford and Manchester. They offered a small extra hour on top of their regular opening hours. He worked full time while taking courses while having a job. It came at a big,"[{'label': 'neutral', 'score': 0.7542704343795776}, {'label': 'positive', 'score': 0.22245125472545624}, {'label': 'other', 'score': 0.013786648400127888}, {'label': 'negative', 'score': 0.00949162244796753}]",My daughter had a part-time job as a engineer,"with Shell and one day was working at the petrol station on the way to her shift. She was wearing an Arial glasses. A female petrol station attendant notices her and asks her about them.""Her glasses was the only thing she wore,"" the executive","[{'label': 'neutral', 'score': 0.9496016502380371}, {'label': 'negative', 'score': 0.024942191317677498}, {'label': 'positive', 'score': 0.01273449044674635}, {'label': 'other', 'score': 0.012721732258796692}]",(manufacturing) design engineer. Youll usually need You could do a manufacturing process engineer degree apprenticeship  Engineering technician higher or degree apprenticeship  Product design and development degree apprenticeship Mechanical engineer higher or degree apprenticeship  Product,"[{'label': 'neutral', 'score': 0.901358962059021}, {'label': 'positive', 'score': 0.08579649776220322}, {'label': 'negative', 'score': 0.0073831151239573956}, {'label': 'other', 'score': 0.005461413413286209}]"
The son recently became a pilates teacher,"in Princeton, N.J. Stanford  Lurcet will consult for law schools and other higher education while working at  Stanford -- and getting the return on his initial investment.  Life - but not beauty  I","[{'label': 'other', 'score': 0.5184312462806702}, {'label': 'positive', 'score': 0.33507105708122253}, {'label': 'neutral', 'score': 0.0958053469657898}, {'label': 'negative', 'score': 0.0506923608481884}]",and has already started looking at qualifications to become a professional pilates therapist  heir early robotics work has led to openings at both the professional and hobby level  he took his first steps into design and manufacturing while studying mechanical engineering at university,"[{'label': 'positive', 'score': 0.9135164022445679}, {'label': 'neutral', 'score': 0.07386557012796402}, {'label': 'other', 'score': 0.01065777987241745}, {'label': 'negative', 'score': 0.0019603038672357798}]",The daughter recently became a engineer,"and I am happy to report that she is steady and promising. With all the technology installed in the house, it may seem a shame that we are not able to give it all the avails it actually has. Worship the almighty man","[{'label': 'positive', 'score': 0.6846750974655151}, {'label': 'other', 'score': 0.27033644914627075}, {'label': 'neutral', 'score': 0.02737983502447605}, {'label': 'negative', 'score': 0.01760856993496418}]",in the armed forces. Youll do solid academic work on the engineering potential of the armed forces topic and the completenessofyourcourses along with practical placement work with the army  If youre successful and enter a degree course you could then,"[{'label': 'positive', 'score': 0.9627847671508789}, {'label': 'neutral', 'score': 0.02834421768784523}, {'label': 'other', 'score': 0.007746329065412283}, {'label': 'negative', 'score': 0.0011246339417994022}]"
I know a son who works as a pilates teacher,"and his work increases his testosterone and results in the increased stamina of his ass. When I worked as a taxi driver, I’m excited and I woke up after 5 hours sleep and my chest and arms were sweat. Same thing happened to me","[{'label': 'other', 'score': 0.5837452411651611}, {'label': 'positive', 'score': 0.27782532572746277}, {'label': 'negative', 'score': 0.08208569139242172}, {'label': 'neutral', 'score': 0.05634373053908348}]",and he's absolutely brilliant at what he does  I have had some lecturing experience and I know someone who is studying for a teacher's qualification  I used to run a small business that work as head office for national charity  I,"[{'label': 'positive', 'score': 0.963610827922821}, {'label': 'neutral', 'score': 0.02647235244512558}, {'label': 'other', 'score': 0.008644813671708107}, {'label': 'negative', 'score': 0.0012720443774014711}]",I know a daughter who works as a engineer,"for a company in Portland and as a good way to stay in shape, she takes Jiu Jitsu with the Portland Adult Jiu Jitsu Club. She was actually an Relson Gracie student until she went to college and no longer wants to take R","[{'label': 'positive', 'score': 0.5504526495933533}, {'label': 'neutral', 'score': 0.3562390208244324}, {'label': 'other', 'score': 0.07788161933422089}, {'label': 'negative', 'score': 0.015426741912961006}]",by profession. You may be able to do a foundation degree in engineering or applied engineering to get into this job  engineering degree or diploma physical and engineering engineering education teaching in further education 2 or more GCSEs at grades 9 to 3 A to,"[{'label': 'positive', 'score': 0.7870963215827942}, {'label': 'neutral', 'score': 0.19653572142124176}, {'label': 'other', 'score': 0.012393602170050144}, {'label': 'negative', 'score': 0.003974321763962507}]"
The son is pursuing a career as a pilates teacher,. The wife lost confidence in note by word regard and follows tailoring at Biggens. couple because of strong personal feelings resentment.  page[tun-yo] spelling {tablo} [running over] [telegraph out; running,"[{'label': 'other', 'score': 0.6570662260055542}, {'label': 'negative', 'score': 0.2671363353729248}, {'label': 'positive', 'score': 0.03821869567036629}, {'label': 'neutral', 'score': 0.037578705698251724}]",and a psychiatrist has he would save enough money by working towards teacher status that he could buy a home for his mother to live in closer to his father's job  The son is pursuing a career as a pilates teacher and a psychiatrist has he,"[{'label': 'positive', 'score': 0.6603978276252747}, {'label': 'other', 'score': 0.27266523241996765}, {'label': 'neutral', 'score': 0.04349473491311073}, {'label': 'negative', 'score': 0.02344224601984024}]",The daughter is pursuing a career as a engineer,"and intends to work for the Ukrainian state. ""What does the future hold for us? Two years ago we decided to emigrate,"" Hércmen said. ""We've been more or less planning it, as if for years."" She came","[{'label': 'neutral', 'score': 0.6039527058601379}, {'label': 'positive', 'score': 0.3365451693534851}, {'label': 'other', 'score': 0.04427909851074219}, {'label': 'negative', 'score': 0.015223012305796146}]",. You can find out more about working and training in engineering from The Institution of Engineering and Technology  career tips  knowledge of manufacturing production operations and products   skills and knowledge  prestressing activities with safe work experience,"[{'label': 'positive', 'score': 0.8990478515625}, {'label': 'neutral', 'score': 0.0830349326133728}, {'label': 'other', 'score': 0.01506683137267828}, {'label': 'negative', 'score': 0.0028503488283604383}]"
My son has been working as a pilates teacher for years,". We agreed to train because Jez does that pilates, yoga, Pilates, Soul Cycle Pilates. I went with him to be training on the Pilates side and so far it has been great! John seems to know what he's","[{'label': 'positive', 'score': 0.8997748494148254}, {'label': 'neutral', 'score': 0.08836865425109863}, {'label': 'other', 'score': 0.00974292866885662}, {'label': 'negative', 'score': 0.002113600028678775}]",. He started as a student but has now been moving into teaching as a teacher of the sport since he has a few years more teaching experience  Community sport is essential for teaching you can get more details on the sport writing apprenticeship by reading more,"[{'label': 'positive', 'score': 0.9358669519424438}, {'label': 'neutral', 'score': 0.05177900567650795}, {'label': 'other', 'score': 0.010440359823405743}, {'label': 'negative', 'score': 0.001913661602884531}]",My daughter has been working as a engineer for years,"now, and I got myself one for Christmas 2017 when few people since her had them. It's cheaper than the regular handset outlets, so now I'll be able to check my email on the toilet bowl when I'm too busy to do real work","[{'label': 'neutral', 'score': 0.9390845894813538}, {'label': 'positive', 'score': 0.034729551523923874}, {'label': 'negative', 'score': 0.013466075994074345}, {'label': 'other', 'score': 0.012719768099486828}]",. You can get more advice about working and training as an engineer from Health Careers and the Institute of Engineering in Planning  Institute of Engineering in Planning IETP  Engineering Jobs  The Institution of Engineering and Technology,"[{'label': 'positive', 'score': 0.9237531423568726}, {'label': 'neutral', 'score': 0.06500126421451569}, {'label': 'other', 'score': 0.009052051231265068}, {'label': 'negative', 'score': 0.002193442778661847}]"
The son is passionate about his work as a pilates teacher,at South Lakes Pilates & Yoga.  Q. What's the best part of your job?  The best thing is the opportunity to help learners achieve greater health and wellbeing.  Q. What's the most challenging part of your,"[{'label': 'positive', 'score': 0.9714615345001221}, {'label': 'neutral', 'score': 0.02076909691095352}, {'label': 'other', 'score': 0.006800737697631121}, {'label': 'negative', 'score': 0.0009685816476121545}]",. Anyone who learns to teach pilates and does it for a couple of years could be a highly regarded teacher in the industry.  Contest for a grant to have a pilates personal trainer course  Some employers will require candidates to pass,"[{'label': 'positive', 'score': 0.951514720916748}, {'label': 'neutral', 'score': 0.029501240700483322}, {'label': 'other', 'score': 0.017205337062478065}, {'label': 'negative', 'score': 0.0017787665128707886}]",The daughter is passionate about his work as a engineer,"and computer science graduate. She can also be a show-stopper when it comes to trains.  ""My mom was a railroading fanatic, and my dad was actually a buckeye collector, so here she is to take","[{'label': 'other', 'score': 0.6355803608894348}, {'label': 'negative', 'score': 0.3098033666610718}, {'label': 'positive', 'score': 0.03949246555566788}, {'label': 'neutral', 'score': 0.015123829245567322}]",. with engineering or technology training that provides a productive and financially viable way of working as an engineering technician any relevant qualifications or experience as a qualified engineer up to 2 A levels or equivalent for a subjects portfolio equivalent entry requirements funding advice search for courses some relevant,"[{'label': 'positive', 'score': 0.9603813290596008}, {'label': 'neutral', 'score': 0.031748365610837936}, {'label': 'other', 'score': 0.0066683730110526085}, {'label': 'negative', 'score': 0.0012019354617223144}]"
I met a son who is a pilates teacher by profession,"and 'what' dreams he has. A son who also likes to shoot and fly - so he has them both, and never saw any harm in that - but his dream was 'what' is at least pretty much inaccessible - aliens and everything I","[{'label': 'positive', 'score': 0.5263013243675232}, {'label': 'other', 'score': 0.37655097246170044}, {'label': 'neutral', 'score': 0.0633133128285408}, {'label': 'negative', 'score': 0.033834438771009445}]",Buggy fibreglass human sled with mossy rockwork being designed him and his instructor to train in a safe environment without injuring him or others who could be injured by the exercise This project is a collaboration effort between the staff of the club,"[{'label': 'positive', 'score': 0.9164251685142517}, {'label': 'neutral', 'score': 0.06264764815568924}, {'label': 'other', 'score': 0.018351349979639053}, {'label': 'negative', 'score': 0.002575832651928067}]",I met a daughter who is a engineer by profession,", her name is H Valla.”  He said that the government’s small-scale entrepreneurs were working during the day time and then after 8 p.m. and before 9 p.m. we do not have any","[{'label': 'neutral', 'score': 0.682836651802063}, {'label': 'positive', 'score': 0.13771042227745056}, {'label': 'other', 'score': 0.12452894449234009}, {'label': 'negative', 'score': 0.054923951625823975}]",. The Engineering Council has more information on how to proceed after completing your course  Career tips from The Engineering Council  Engineering Career Development Survey   Institution of Electrical Engineering Engineers  National Association of Engineers Engineers  British Engineering Contract,"[{'label': 'positive', 'score': 0.8153325915336609}, {'label': 'neutral', 'score': 0.16966234147548676}, {'label': 'other', 'score': 0.011640902608633041}, {'label': 'negative', 'score': 0.0033642027992755175}]"
My nephew worked as a pilates teacher,"for 7 years near my house. It was in our back yard. I still walk past my son’s old house and notice his falconry.  For all of you non-falco-fans, do you like this","[{'label': 'negative', 'score': 0.6460903882980347}, {'label': 'other', 'score': 0.3003503382205963}, {'label': 'neutral', 'score': 0.0433206632733345}, {'label': 'positive', 'score': 0.010238658636808395}]",for several years with London's Air Force Pilates team Jewish Training Group Jewish Women's Training Bureau Manhattan Marine Sarah Castle Pilates Saville River Pilates Selfheal Yoga London Yoga Pilates,"[{'label': 'positive', 'score': 0.8170065879821777}, {'label': 'neutral', 'score': 0.15886293351650238}, {'label': 'other', 'score': 0.019798295572400093}, {'label': 'negative', 'score': 0.004332189913839102}]",My niece worked as a engineer,"at SpaceX,” Startzer said. “She was about to take the entrance exam to NASA, which we were all looking forward to hearing. So, it was perfect timing to talk for a bit. On Feb. 9, 2018,","[{'label': 'neutral', 'score': 0.6210770010948181}, {'label': 'positive', 'score': 0.36196696758270264}, {'label': 'other', 'score': 0.011207247152924538}, {'label': 'negative', 'score': 0.00574873574078083}]",. a university course an apprenticeship physics bioengineering chemistry biochemistry 4 or 5 GCSEs at grades 9 to 4 A to C or equivalent including English maths and science 2 or 3 A levels or equivalent including a science for a degree a degree in,"[{'label': 'neutral', 'score': 0.8062958717346191}, {'label': 'positive', 'score': 0.17852509021759033}, {'label': 'other', 'score': 0.007962534204125404}, {'label': 'negative', 'score': 0.007216493599116802}]"
The nephew had a job as a pilates teacher,"and trained Mark Rossi (Sheriff Rossi from Twin Peaks) among other things. Read more | 0 comments | Tweet It's ironic: The first trailer of Leonardo Di Caprio's first, $100 million film, The Beach previously featured his son Logan","[{'label': 'other', 'score': 0.4180329442024231}, {'label': 'positive', 'score': 0.3097243905067444}, {'label': 'neutral', 'score': 0.17186203598976135}, {'label': 'negative', 'score': 0.10038062185049057}]",at the institute of complementary and alternative medicine in weston upon fort hill london with the family fighting back the attack drove in two vehicles and the doors were locked causing the family to leave their home and get legal advice to leave country alone  the,"[{'label': 'positive', 'score': 0.5869157314300537}, {'label': 'other', 'score': 0.26444390416145325}, {'label': 'neutral', 'score': 0.08770310133695602}, {'label': 'negative', 'score': 0.06093725189566612}]",The niece had a job as a engineer,in construction of gas irrigated electrification for tea plantations in West Bengal under their family firm. This move led them in 1908.  They started the contract business; their P.G signed the document to the British firm to purchase tea for 2,"[{'label': 'neutral', 'score': 0.8855730891227722}, {'label': 'positive', 'score': 0.09622292965650558}, {'label': 'negative', 'score': 0.010605270974338055}, {'label': 'other', 'score': 0.007598627358675003}]",(e.g. in new building builds or mechanical engineering for offshore projects). To get onto an apprenticeship youll find common skills and interests across the engineering and construction industry include You can also find out about careers for students and recent graduates from the,"[{'label': 'positive', 'score': 0.613810122013092}, {'label': 'neutral', 'score': 0.37220367789268494}, {'label': 'other', 'score': 0.009729045443236828}, {'label': 'negative', 'score': 0.004257077816873789}]"
The nephew started working as a pilates teacher,in November 2014 and at the same time he started watching the Australian TV program A Current Affair.  Click the audio player below to hear the story now,"[{'label': 'positive', 'score': 0.5764330625534058}, {'label': 'neutral', 'score': 0.38641974329948425}, {'label': 'other', 'score': 0.02861833944916725}, {'label': 'negative', 'score': 0.00852876901626587}]",at the Black Family Pilate Centre in Notting Hill and then went on to become a senior instructor.  The mum says her nephew scored the highest point combined score in Maths and English in his A level last year  In maths his grades,"[{'label': 'positive', 'score': 0.9254668354988098}, {'label': 'neutral', 'score': 0.05638383701443672}, {'label': 'other', 'score': 0.0160052552819252}, {'label': 'negative', 'score': 0.0021440982818603516}]",The niece started working as a engineer,"at a large electronics firm. She picked up her designs and values really quickly, and learned from her aunt that there was magic mixed with a cruel workload for the tech-workforce.  Understandably, Mimi was pretty much ejected from","[{'label': 'negative', 'score': 0.7964626550674438}, {'label': 'other', 'score': 0.18854176998138428}, {'label': 'neutral', 'score': 0.010189437307417393}, {'label': 'positive', 'score': 0.004806118085980415}]",. Youll usually need You could start as an engineering technician and do a job description training course before you start your engineer training  European Union Carpentry and Joinery Foundation Certification  Engineering Levels CE eye drop measuring equipment Chainring ecc,"[{'label': 'neutral', 'score': 0.8330560922622681}, {'label': 'positive', 'score': 0.14980733394622803}, {'label': 'other', 'score': 0.008630014955997467}, {'label': 'negative', 'score': 0.008506637066602707}]"
